{
  "schema_version": 2,
  "skill_name": "CRP Link Repos",
  "execution_mode": "python_launcher",
  "supported_os": [
    "macos",
    "linux",
    "windows"
  ],
  "unsupported_behavior": "fail_fast",
  "preflight": {
    "cache_ttl_seconds": 600,
    "checks": [
      {
        "type": "tool",
        "name": "python",
        "install_hint": {
          "macos": "Install Python 3 and ensure python3 is in PATH.",
          "linux": "Install python3 and ensure it is in PATH.",
          "windows": "Install Python 3 or the py launcher and ensure it is in PATH."
        }
      },
      {
        "type": "tool",
        "name": "bash",
        "install_hint": {
          "macos": "Install bash and ensure it is in PATH.",
          "linux": "Install bash and ensure it is in PATH.",
          "windows": "Install Git Bash or another bash-compatible shell and ensure bash is in PATH."
        }
      },
      {
        "type": "tool",
        "name": "git",
        "install_hint": {
          "default": "Install Git and ensure it is in PATH."
        }
      }
    ]
  },
  "entrypoint": {
    "kind": "python",
    "path": "scripts/run.py"
  },
  "tooling": {
    "python": {
      "macos": [
        "python3"
      ],
      "linux": [
        "python3"
      ],
      "windows": [
        "py",
        "-3"
      ]
    },
    "bash": {
      "macos": [
        "bash"
      ],
      "linux": [
        "bash"
      ],
      "windows": [
        "bash"
      ]
    },
    "git": {
      "macos": [
        "git"
      ],
      "linux": [
        "git"
      ],
      "windows": [
        "git"
      ]
    }
  },
  "default_command": "crp-all",
  "commands": [
    {
      "name": "crp-all",
      "description": "Run crp_all.sh",
      "kind": "shell",
      "path": "scripts/crp_all.sh",
      "args": []
    },
    {
      "name": "sync-crp-all",
      "description": "Run sync_crp_all.sh",
      "kind": "shell",
      "path": "scripts/sync_crp_all.sh",
      "args": []
    },
    {
      "name": "sync-crp-cloud-repos",
      "description": "Run sync_crp_cloud_repos.py",
      "kind": "python",
      "path": "scripts/sync_crp_cloud_repos.py",
      "args": []
    }
  ],
  "recording": {
    "enabled_by_default": false,
    "output_dir_template": "~/.codex/tmp/skill-runs/{skill}/{timestamp}",
    "artifacts": [
      "run.json",
      "command.txt",
      "stdout.log",
      "stderr.log"
    ]
  }
}
