{
  "schema_version": 2,
  "skill_name": "skill-creator",
  "execution_mode": "python_launcher",
  "supported_os": [
    "macos",
    "linux",
    "windows"
  ],
  "unsupported_behavior": "fail_fast",
  "preflight": {
    "cache_ttl_seconds": 600,
    "checks": [
      {
        "type": "tool",
        "name": "python",
        "install_hint": {
          "macos": "Install Python 3 and ensure python3 is in PATH.",
          "linux": "Install python3 and ensure it is in PATH.",
          "windows": "Install Python 3 or the py launcher and ensure it is in PATH."
        }
      }
    ]
  },
  "entrypoint": {
    "kind": "python",
    "path": "scripts/run.py"
  },
  "tooling": {
    "python": {
      "macos": [
        "python3"
      ],
      "linux": [
        "python3"
      ],
      "windows": [
        "py",
        "-3"
      ]
    }
  },
  "default_command": "init-skill",
  "commands": [
    {
      "name": "init-skill",
      "description": "Create a new skill scaffold",
      "kind": "python",
      "path": "scripts/init_skill.py",
      "args": []
    },
    {
      "name": "generate-openai-yaml",
      "description": "Generate agents/openai.yaml",
      "kind": "python",
      "path": "scripts/generate_openai_yaml.py",
      "args": []
    },
    {
      "name": "quick-validate",
      "description": "Validate a skill folder",
      "kind": "python",
      "path": "scripts/quick_validate.py",
      "args": []
    }
  ],
  "recording": {
    "enabled_by_default": false,
    "output_dir_template": "~/.codex/tmp/skill-runs/{skill}/{timestamp}",
    "artifacts": [
      "run.json",
      "command.txt",
      "stdout.log",
      "stderr.log"
    ]
  }
}
