{
  "schema_version": 2,
  "skill_name": "codeliver-npm-install-repos",
  "execution_mode": "python_launcher",
  "supported_os": [
    "macos",
    "linux",
    "windows"
  ],
  "unsupported_behavior": "fail_fast",
  "preflight": {
    "cache_ttl_seconds": 600,
    "checks": [
      {
        "type": "tool",
        "name": "bash",
        "install_hint": {
          "macos": "Install bash and ensure it is in PATH.",
          "linux": "Install bash and ensure it is in PATH.",
          "windows": "Install Git Bash or another bash-compatible shell and ensure bash is in PATH."
        }
      },
      {
        "type": "tool",
        "name": "npm",
        "install_hint": {
          "default": "Install npm and ensure it is in PATH."
        }
      }
    ]
  },
  "entrypoint": {
    "kind": "python",
    "path": "scripts/run.py"
  },
  "tooling": {
    "bash": {
      "macos": [
        "bash"
      ],
      "linux": [
        "bash"
      ],
      "windows": [
        "bash"
      ]
    },
    "npm": {
      "macos": [
        "npm"
      ],
      "linux": [
        "npm"
      ],
      "windows": [
        "npm"
      ]
    }
  },
  "default_command": "npm-install-all-codeliver-repos",
  "commands": [
    {
      "name": "npm-install-all-codeliver-repos",
      "description": "Run npm_install_all_codeliver_repos.sh",
      "kind": "shell",
      "path": "scripts/npm_install_all_codeliver_repos.sh",
      "args": []
    }
  ],
  "recording": {
    "enabled_by_default": false,
    "output_dir_template": "~/.codex/tmp/skill-runs/{skill}/{timestamp}",
    "artifacts": [
      "run.json",
      "command.txt",
      "stdout.log",
      "stderr.log"
    ]
  }
}
