{
  "schema_version": 2,
  "skill_name": "optc-team-builder-android-release",
  "execution_mode": "python_launcher",
  "supported_os": [
    "macos",
    "linux",
    "windows"
  ],
  "unsupported_behavior": "fail_fast",
  "preflight": {
    "cache_ttl_seconds": 600,
    "checks": [
      {
        "type": "tool",
        "name": "bash",
        "install_hint": {
          "default": "Install bash and ensure it is in PATH."
        }
      },
      {
        "type": "tool",
        "name": "git",
        "install_hint": {
          "default": "Install Git and ensure it is in PATH."
        }
      },
      {
        "type": "tool",
        "name": "node",
        "install_hint": {
          "default": "Install Node.js and ensure node is in PATH."
        }
      },
      {
        "type": "tool",
        "name": "npm",
        "install_hint": {
          "default": "Install npm and ensure it is in PATH."
        }
      },
      {
        "type": "tool",
        "name": "java",
        "install_hint": {
          "default": "Install Java and ensure java is in PATH."
        }
      }
    ]
  },
  "entrypoint": {
    "kind": "python",
    "path": "scripts/run.py"
  },
  "tooling": {
    "bash": {
      "macos": [
        "bash"
      ],
      "linux": [
        "bash"
      ],
      "windows": [
        "bash"
      ]
    },
    "git": {
      "macos": [
        "git"
      ],
      "linux": [
        "git"
      ],
      "windows": [
        "git"
      ]
    },
    "node": {
      "macos": [
        "node"
      ],
      "linux": [
        "node"
      ],
      "windows": [
        "node"
      ]
    },
    "npm": {
      "macos": [
        "npm"
      ],
      "linux": [
        "npm"
      ],
      "windows": [
        "npm"
      ]
    },
    "java": {
      "macos": [
        "java"
      ],
      "linux": [
        "java"
      ],
      "windows": [
        "java"
      ]
    }
  },
  "default_command": "run-release",
  "commands": [
    {
      "name": "run-release",
      "description": "Run run_release.sh",
      "kind": "shell",
      "path": "scripts/run_release.sh",
      "args": []
    }
  ],
  "recording": {
    "enabled_by_default": false,
    "output_dir_template": "~/.codex/tmp/skill-runs/{skill}/{timestamp}",
    "artifacts": [
      "run.json",
      "command.txt",
      "stdout.log",
      "stderr.log"
    ]
  }
}
