{
  "schema_version": 2,
  "skill_name": "repos-dsstore-auto-commit-push",
  "execution_mode": "python_launcher",
  "supported_os": [
    "macos",
    "linux",
    "windows"
  ],
  "unsupported_behavior": "fail_fast",
  "preflight": {
    "cache_ttl_seconds": 600,
    "checks": [
      {
        "type": "tool",
        "name": "bash",
        "install_hint": {
          "macos": "Install bash and ensure it is in PATH.",
          "linux": "Install bash and ensure it is in PATH.",
          "windows": "Install Git Bash or another bash-compatible shell and ensure bash is in PATH."
        }
      },
      {
        "type": "tool",
        "name": "git",
        "install_hint": {
          "default": "Install Git and ensure it is in PATH."
        }
      },
      {
        "type": "tool",
        "name": "rg",
        "install_hint": {
          "default": "Install ripgrep and ensure rg is in PATH."
        }
      }
    ]
  },
  "entrypoint": {
    "kind": "python",
    "path": "scripts/run.py"
  },
  "tooling": {
    "bash": {
      "macos": [
        "bash"
      ],
      "linux": [
        "bash"
      ],
      "windows": [
        "bash"
      ]
    },
    "git": {
      "macos": [
        "git"
      ],
      "linux": [
        "git"
      ],
      "windows": [
        "git"
      ]
    },
    "rg": {
      "macos": [
        "rg"
      ],
      "linux": [
        "rg"
      ],
      "windows": [
        "rg"
      ]
    }
  },
  "default_command": "fix-ds-store-and-commit-push",
  "commands": [
    {
      "name": "fix-ds-store-and-commit-push",
      "description": "Run fix_ds_store_and_commit_push.sh",
      "kind": "shell",
      "path": "scripts/fix_ds_store_and_commit_push.sh",
      "args": []
    }
  ],
  "recording": {
    "enabled_by_default": false,
    "output_dir_template": "$CODEX_HOME/tmp/skill-runs/{skill}/{timestamp}",
    "artifacts": [
      "run.json",
      "command.txt",
      "stdout.log",
      "stderr.log"
    ]
  }
}
